"Question";"Answer"
"How many days of leave is an employee entitled to?";"An employee is entitled to 20 days of leave per year if employed for less than 10 years, and 26 days if employed for at least 10 years."
"What does the number of days of leave depend on?";"The number of days of leave depends on the employee's total length of service, including previous periods of employment."
"What social benefits does the company offer?";"The company offers social benefits such as subsidies for recreation, Christmas packages for employees' children, and emergency financial aid."
"What should be done in the event of a work accident?";"In the event of a work accident, the supervisor and the OHS department should be immediately notified, and the accident site should be secured."
"How to report an illness?";"An illness should be reported to the supervisor and a medical certificate should be provided no later than 7 days from its issuance."
"When is the salary paid?";"The salary is paid on the last working day of the month."
